<?xml version="1.0" encoding="UTF-8"?>
<esperhq-configuration xmlns:xsi="http://www.w3.org/2001/XMLSchema-instance" xmlns="http://www.espertech.com/schema/esperhq" xsi:noNamespaceSchemaLocation="esperhq-configuration-5-0.xsd">
	<client>
		<authentication provider-type="none" remember-me="true">	<!-- Set to 'local' to enable authorization and authentication against below list. -->
			<password-encoder hash="md5"/>
				<!-- 
                   Usernames and passwords below are
					rod/koala
					dianne/emu
					peter/cat -->
			<users>
				<user name="rod" password="a564de63c2d0da68cf47586ee05984d7" authorities="EHQ_ADMIN" />
				<user name="dianne" password="65d15fe9156f9c4bbffd98085992a44e" authorities="EHQ_RO" />
				<user name="peter" password="d077f244def8a70e5ea758bd8352fcd8" authorities="EHQ_EXEC" />
			</users>
		</authentication>
	</client>
	<endpoints>
		<endpoint name="endpoint-one" default="true">
			<context object-name="ConnectionFactory">
				<env name="java.naming.factory.initial" value="org.apache.activemq.jndi.ActiveMQInitialContextFactory"/>
				<env name="java.naming.provider.url" value="tcp://host_a:61616?wireFormat.maxInactivityDuration=0"/>
				<env name="java.naming.security.principal" value=""/>
				<env name="java.naming.security.credentials" value=""/>
			</context>
			<restservice hosts="http://host_a:8400" cepmgmtsvc-token="cepmgmtsvctoken" ceppushsvc-token="ceppushsvctoken"/>  <!-- use local keyword for local rest service -->
		</endpoint>
		<endpoint name="endpoint-two" default="true">
			<context object-name="ConnectionFactory">
				<env name="java.naming.factory.initial" value="org.apache.activemq.jndi.ActiveMQInitialContextFactory"/>
				<env name="java.naming.provider.url" value="tcp://host_b:61616?wireFormat.maxInactivityDuration=0"/>
				<env name="java.naming.security.principal" value=""/>
				<env name="java.naming.security.credentials" value=""/>
			</context>
			<restservice hosts="http://host_b:8400" cepmgmtsvc-token="cepmgmtsvctoken" ceppushsvc-token="ceppushsvctoken"/>  <!-- use local keyword for local rest service -->
		</endpoint>
	</endpoints>
	<store>
		<directory path="${ESPEREE_BASE}/data/hqsvc"/>
	</store>	
</esperhq-configuration>
